{
  "schemaVersion": "1.1.0",
  "surface": "enceladus",
  "generatedAt": "2026-10-11T22:01:53Z",
  "actions": [
    {
      "name": "actions.schemas",
      "title": "List action schemas",
      "inputSchema": {
        "type": "object",
        "properties": {
          "via": {
            "type": "string",
            "enum": [
              "top-level",
              "search",
              "coordination",
              "execute"
            ],
            "description": "Restrict the listing to one surface."
          },
          "names": {
            "type": "array",
            "items": {
              "type": "string"
            },
            "description": "Restrict the listing to these action names."
          }
        }
      },
      "outputSchema": null,
      "annotations": {
        "readOnlyHint": true,
        "destructiveHint": false,
        "idempotentHint": true
      },
      "requiresGovernanceHash": false,
      "via": "search"
    },
    {
      "name": "agent.checkout_release_backfill",
      "title": "Release checkouts of retired sessions",
      "inputSchema": {
        "type": "object",
        "properties": {
          "dry_run": {
            "type": "boolean",
            "description": "If true, report the checkouts that would be released without releasing them."
          },
          "session_ids": {
            "type": "array",
            "items": {
              "type": "string"
            },
            "description": "Restrict the backfill to these retired session ids."
          }
        }
      },
      "outputSchema": null,
      "annotations": {
        "readOnlyHint": false,
        "destructiveHint": true,
        "idempotentHint": false
      },
      "requiresGovernanceHash": false,
      "via": "coordination",
      "dryRun": true
    },
    {
      "name": "agent.claim",
      "title": "Claim agent session",
      "inputSchema": {
        "type": "object",
        "properties": {
          "session_id": {
            "type": "string",
            "description": "Pre-minted session id (ENC-SES-...) to claim."
          },
          "expected_agent_type_id": {
            "type": "string",
            "description": "Agent type id the claim must match."
          }
        },
        "required": [
          "session_id"
        ]
      },
      "outputSchema": {
        "type": "object",
        "properties": {
          "sci": {
            "type": "string",
            "x-io-minted": true,
            "description": "Session Claim ID issued on claim (ENC-ISS-441); never supply on input."
          }
        }
      },
      "annotations": {
        "readOnlyHint": false,
        "destructiveHint": false,
        "idempotentHint": false
      },
      "requiresGovernanceHash": false,
      "via": "coordination",
      "dryRun": true
    },
    {
      "name": "agent.list",
      "title": "List agent sessions",
      "inputSchema": {
        "type": "object",
        "properties": {
          "status": {
            "type": "string",
            "description": "Filter by session status."
          },
          "agent_type_id": {
            "type": "string",
            "description": "Filter by agent type id."
          }
        }
      },
      "outputSchema": null,
      "annotations": {
        "readOnlyHint": true,
        "destructiveHint": false,
        "idempotentHint": true
      },
      "requiresGovernanceHash": false,
      "via": "coordination"
    },
    {
      "name": "agent.register",
      "title": "Register agent session",
      "inputSchema": {
        "type": "object",
        "properties": {
          "agent_type_id": {
            "type": "string",
            "description": "Agent type id (ENC-AGT-...)."
          },
          "runtime": {
            "type": "string",
            "description": "Runtime identifier for the session."
          },
          "parent_session_id": {
            "type": "string",
            "description": "Parent session id (ENC-SES-...)."
          },
          "status": {
            "type": "string",
            "description": "Initial session status."
          },
          "credential_id": {
            "type": "string",
            "description": "Optional ENC-CRED credential binding (ENC-TSK-J43)."
          }
        }
      },
      "outputSchema": {
        "type": "object",
        "properties": {
          "session_id": {
            "type": "string",
            "x-io-minted": true,
            "description": "Minted server-side; never supply on input."
          }
        }
      },
      "annotations": {
        "readOnlyHint": false,
        "destructiveHint": false,
        "idempotentHint": false
      },
      "requiresGovernanceHash": false,
      "via": "coordination",
      "dryRun": true
    },
    {
      "name": "agent.retire",
      "title": "Retire agent session",
      "inputSchema": {
        "type": "object",
        "properties": {
          "session_id": {
            "type": "string",
            "description": "Session id (ENC-SES-...) to retire."
          }
        },
        "required": [
          "session_id"
        ]
      },
      "outputSchema": null,
      "annotations": {
        "readOnlyHint": false,
        "destructiveHint": false,
        "idempotentHint": false
      },
      "requiresGovernanceHash": false,
      "via": "coordination",
      "dryRun": true
    },
    {
      "name": "agent.type.list",
      "title": "List agent types",
      "inputSchema": {
        "type": "object",
        "properties": {
          "status": {
            "type": "string",
            "description": "Filter by agent-type status."
          }
        }
      },
      "outputSchema": null,
      "annotations": {
        "readOnlyHint": true,
        "destructiveHint": false,
        "idempotentHint": true
      },
      "requiresGovernanceHash": false,
      "via": "coordination"
    },
    {
      "name": "agent.type.register",
      "title": "Register agent type",
      "inputSchema": {
        "type": "object",
        "properties": {
          "surface": {
            "type": "string",
            "description": "Agent surface (for example claude-code)."
          },
          "model": {
            "type": "string",
            "description": "Model identifier."
          },
          "cost_tier": {
            "type": "string",
            "description": "Cost tier."
          }
        }
      },
      "outputSchema": {
        "type": "object",
        "properties": {
          "agent_type_id": {
            "type": "string",
            "x-io-minted": true,
            "description": "Minted server-side; never supply on input."
          }
        }
      },
      "annotations": {
        "readOnlyHint": false,
        "destructiveHint": false,
        "idempotentHint": true
      },
      "requiresGovernanceHash": false,
      "via": "coordination",
      "dryRun": true
    },
    {
      "name": "auth.cognito_session",
      "title": "Create Cognito session",
      "inputSchema": {
        "type": "object",
        "properties": {
          "target_origin": {
            "type": "string",
            "description": "Optional https origin for browser cookie scoping (default: https://jreese.net)."
          },
          "include_set_cookie_headers": {
            "type": "boolean",
            "description": "Include serialized Set-Cookie header strings in the response. Default true.",
            "default": true
          },
          "include_tokens": {
            "type": "boolean",
            "description": "Include raw Cognito tokens in response for advanced debugging. Default false.",
            "default": false
          }
        }
      },
      "outputSchema": null,
      "annotations": {
        "readOnlyHint": false,
        "destructiveHint": false,
        "idempotentHint": false
      },
      "requiresGovernanceHash": false,
      "via": "coordination",
      "dryRun": true
    },
    {
      "name": "capabilities.get",
      "title": "Get coordination capabilities",
      "inputSchema": {
        "type": "object",
        "properties": {}
      },
      "outputSchema": null,
      "annotations": {
        "readOnlyHint": true,
        "destructiveHint": false,
        "idempotentHint": true
      },
      "requiresGovernanceHash": false,
      "via": "coordination"
    },
    {
      "name": "changelog.history",
      "title": "Get changelog history",
      "inputSchema": {
        "type": "object",
        "properties": {
          "project_id": {
            "type": "string",
            "description": "The project name (e.g., 'enceladus', 'devops')."
          },
          "limit": {
            "type": "integer",
            "description": "Max entries to return (default 20, max 100).",
            "default": 20
          },
          "change_type": {
            "type": "string",
            "description": "Filter by change type: 'major', 'minor', or 'patch'.",
            "enum": [
              "major",
              "minor",
              "patch"
            ]
          }
        },
        "required": [
          "project_id"
        ]
      },
      "outputSchema": null,
      "annotations": {
        "readOnlyHint": true,
        "destructiveHint": false,
        "idempotentHint": true
      },
      "requiresGovernanceHash": false,
      "via": "search"
    },
    {
      "name": "changelog.history_all",
      "title": "Get changelog history across projects",
      "inputSchema": {
        "type": "object",
        "properties": {
          "projects": {
            "type": "string",
            "description": "Comma-separated project names (e.g., 'enceladus,devops,harrisonfamily')."
          },
          "limit": {
            "type": "integer",
            "description": "Max entries per project to return (default 20, max 100).",
            "default": 20
          },
          "change_type": {
            "type": "string",